{
  "Id": "memory-system-rfc-council-review-20260520",
  "Title": "Memory System RFC Council Review",
  "Content": "This record summarizes a historical council review, not an active roadmap. The review established a current governance rule for MemorySmith memory design: use convention-first, validation-backed, evidence-gated changes before promoting new durable schema fields. The related page sources hold the RFC and council workflow details. Existing implemented conventions include tag namespaces, diagnostics, staleness warnings, relationship/source-link checks, chat trace evidence, and warning-first maintenance. Proposed schema fields such as Relations, Constraints, ValidUntil, ReviewAfter, or Priority remain page-level design material until code and retrieval behavior need reliable machine parsing. The LLM council page is a MemorySmith-specific multi-perspective review workflow.",
  "Status": 1,
  "Confidence": 0.82,
  "Tags": [
    "project-wiki",
    "memory-system",
    "rfc",
    "council-review",
    "agent-memory",
    "search",
    "chat",
    "pages"
  ],
  "References": [
    "project-wiki-search-roadmap",
    "project-wiki-chat-agent-provider",
    "project-wiki-markdown-pages",
    "project-wiki-mcp-context-pack"
  ],
  "Conflicts": [],
  "SourceLinks": [
    {
      "Label": "Core Memory System Improvements RFC",
      "Uri": "%MemorySmithRepo%Data/Pages/temp-plan.md"
    },
    {
      "Label": "Council Workflow",
      "Uri": "%MemorySmithRepo%Data/Pages/llm-council.md"
    },
    {
      "Label": "Search and Chat",
      "Uri": "%MemorySmithRepo%Data/Pages/search-and-chat.md"
    }
  ],
  "UsageCount": 0,
  "LastUpdated": "2026-05-22T09:20:00Z"
}