{
  "Id": "ai-memory-suite-governance-foundation-20260520",
  "Title": "AI Memory Suite Governance Foundation",
  "Content": "The AI Memory Suite governance foundation is implemented as warning-first behavior rather than automatic destructive cleanup. MemorySmith:Maintenance:AutomaticDeprecationEnabled defaults false, so low-score records produce DeprecationRecommended events instead of silent Deprecated status moves. A file-backed tag policy lives at Data/Policies/tag-policy.json, and MemoryDiagnosticsService reports tag, source-link, relationship, staleness, and maintenance warnings without changing ranking or the persisted memory schema. Context-pack JSON preserves records/warnings while adding schemaVersion memorysmith.context-pack.v1 and per-record diagnostics. The /memories workbench shows diagnostic chips and a selected-record diagnostics panel. The /tags Tag Manager is the current user-facing policy editor for tag usage, namespaces, allow/block lists, aliases, and suggestions. Roadmap details and unimplemented proposals live in Data/Pages rather than this memory record.",
  "Status": 1,
  "Confidence": 0.82,
  "Tags": [
    "project-wiki",
    "memory-system",
    "implementation-status",
    "tag-governance",
    "staleness",
    "maintenance",
    "context-pack",
    "diagnostics"
  ],
  "References": [
    "ai-memory-suite-implementation-plan-20260520",
    "memory-system-rfc-council-review-20260520",
    "project-wiki-mcp-context-pack",
    "project-wiki-semantic-ui-current"
  ],
  "Conflicts": [],
  "SourceLinks": [
    {
      "Label": "Memory governance guide",
      "Uri": "%MemorySmithRepo%Data/Pages/memory-governance-guide.md"
    },
    {
      "Label": "Tag policy",
      "Uri": "%MemorySmithRepo%Data/Policies/tag-policy.json"
    },
    {
      "Label": "Memory governance services",
      "Uri": "%MemorySmithRepo%MemorySmith.App/Services/MemoryGovernanceServices.cs"
    },
    {
      "Label": "Maintenance tasks",
      "Uri": "%MemorySmithRepo%MemorySmith.App/Services/MemoryMaintenanceTasks.cs"
    },
    {
      "Label": "Context pack DTOs",
      "Uri": "%MemorySmithRepo%MemorySmith.App/Services/MemoryQueries.cs"
    },
    {
      "Label": "Diagnostics tests",
      "Uri": "%MemorySmithRepo%MemorySmith.Tests/MemoryDiagnosticsTests.cs"
    }
  ],
  "UsageCount": 0,
  "LastUpdated": "2026-05-22T09:20:00Z"
}