{
  "Id": "project-wiki-admin-configuration-surface",
  "Title": "Admin Configuration Surface Current State",
  "Content": "The /admin workbench is the authenticated Admin surface for users, OAuth sign-in provider enablement, chat model profiles, configuration, audit, and history. The Models tab uses ChatModelProfileService to manage MemorySmith:Chat:ModelProfiles, DefaultModelProfileId, and maintenance-agent model assignment ids in appsettings.LocalDevelopment.json or MemorySmith:SettingsOverridePath; admins can define profile name, provider, model id, optional context-window tokens, enabled state, default chat profile, maintenance-run/proposal-review/Admin Maintenance chat assignments, role allowlist, and description. Tag governance remains a separate Admin-only main navigation page at /tags rather than an Admin tab. Configuration rows come from AdminSettingsService.ListEditableSettings, persist through AdminSettingsService.UpdateAsync into the same override settings file, reload IConfigurationRoot, and record settings.updated audit entries. The Configuration tab covers broad MemorySmithOptions groups and each editable row exposes an info-circle tooltip sourced from AdminSettingItem.HelpText. Each row shows the friendly setting name plus info icon first and the configuration key on the following line. Sensitive values such as API keys, OAuth secrets, bootstrap token hashes, and database connection strings are write-only in the UI: the table reports Configured or Not configured but does not echo the stored value.",
  "Status": 2,
  "Confidence": 0.92,
  "Tags": [
    "project-wiki",
    "configuration",
    "admin",
    "ui",
    "security",
    "current-state",
    "kind:fact",
    "audience:admin",
    "scope:configuration"
  ],
  "References": [
    "project-wiki-configuration-settings-current",
    "project-wiki-tag-governance-current",
    "project-wiki-admin-auth-hardening",
    "project-wiki-operational-diagnostics-dashboard"
  ],
  "Conflicts": [],
  "SourceLinks": [
    {
      "Label": "Admin.razor",
      "Uri": "%MemorySmithRepo%MemorySmith.App/Components/Pages/Admin.razor"
    },
    {
      "Label": "ChatModelProfileService.cs",
      "Uri": "%MemorySmithRepo%MemorySmith.App/Services/ChatModelProfileService.cs"
    },
    {
      "Label": "AdminSettingsService.cs",
      "Uri": "%MemorySmithRepo%MemorySmith.App/Services/AdminSettingsService.cs"
    },
    {
      "Label": "AdminController.cs",
      "Uri": "%MemorySmithRepo%MemorySmith.App/Controllers/AdminController.cs"
    },
    {
      "Label": "App API contract tests",
      "Uri": "%MemorySmithRepo%MemorySmith.Tests/AppApiContractTests.cs"
    }
  ],
  "UsageCount": 0,
  "LastUpdated": "2026-05-22T19:05:00Z"
}