{
  "Id": "project-wiki-semantic-search-gap",
  "Title": "Semantic Search Gap",
  "Content": "The semantic scoring path has known gaps. Since TSK-0271 removed the standalone memorysmith_semantic_search tool, the semantic signal runs only inside hybrid search (RRF fusion) and the code-search ranker — the gaps below apply to that fused path. When ONNX embeddings are unavailable (model missing, provider init failure, dimension mismatch), the system falls back silently to token-based scoring with alias expansion — the legacy JSON response shape does not surface provider metadata, so clients may not realize embeddings didn't run. The alias dictionary (SearchAliases in MemoryApplicationService) is hand-curated against the project wiki, meaning the in-repo MRR test (MRR>=0.55) overfits to the fixture corpus. The WordPiece tokenizer hardcodes lowercasing (wrong for cased models), lacks Unicode NFC normalization, and does not split CJK characters. Code search stores vector embeddings as JSON TEXT (not BLOB), uses a scalar dot product (no SIMD), and performs brute-force scan unless the SQL prefilter engages. TSK-0199 tracks the ANN migration plan; TSK-0200 tracks provider metadata surfacing.",
  "Status": 2,
  "Confidence": 0.85,
  "Tags": [
    "current-state",
    "hybrid-search",
    "project-wiki",
    "search",
    "semantic-search"
  ],
  "References": [
    "project-wiki-search-roadmap",
    "project-wiki-hybrid-search-rrf",
    "project-wiki-onnx-semantic-embeddings",
    "project-wiki-scope-boundaries"
  ],
  "Conflicts": [],
  "UsageCount": 2,
  "LastUpdated": "2026-06-11T23:23:31Z",
  "SourceLinks": [
    {
      "Label": "MemoryApplicationService.cs (SemanticSearchAsync)",
      "Uri": "%MemorySmithRepo%MemorySmith.App/Services/MemoryApplicationService.cs",
      "StartLine": 120,
      "EndLine": 145
    },
    {
      "Label": "ScoringTests.cs",
      "Uri": "%MemorySmithRepo%MemorySmith.Tests/ScoringTests.cs"
    }
  ]
}