{
  "Id": "project-wiki-semantic-tool-quality-suite",
  "Content": "SemanticToolQualityTests validates project-wiki semantic and hybrid relevance probes, aggregate MRR, deterministic search ordering, MCP tool schema exposure, useful tool output, source_bundle resolution, find_by_source mappings, and JSON-RPC batch notification behavior. MemoryApplicationServiceTests adds CI-safe fake-provider coverage for the embedding ranker so tests do not require a local ONNX model. The quality thresholds still run against the token fallback unless model assets are explicitly configured in the test environment.",
  "Title": "Semantic and MCP tool quality tests",
  "Status": 2,
  "Confidence": 0.92,
  "Tags": [
    "mcp",
    "project-wiki",
    "semantic-search",
    "tests"
  ],
  "References": [
    "project-wiki-onnx-semantic-embeddings",
    "project-wiki-search-roadmap"
  ],
  "Conflicts": [],
  "SourceLinks": [
    {
      "Label": "Semantic and hybrid probes",
      "Uri": "%MemorySmithRepo%MemorySmith.Tests/SemanticToolQualityTests.cs",
      "StartLine": 20,
      "EndLine": 49
    },
    {
      "Label": "Semantic relevance and MRR checks",
      "Uri": "%MemorySmithRepo%MemorySmith.Tests/SemanticToolQualityTests.cs",
      "StartLine": 57,
      "EndLine": 88
    },
    {
      "Label": "MCP usefulness checks",
      "Uri": "%MemorySmithRepo%MemorySmith.Tests/SemanticToolQualityTests.cs",
      "StartLine": 123,
      "EndLine": 195
    },
    {
      "Label": "Search quality probe type",
      "Uri": "%MemorySmithRepo%MemorySmith.Tests/SemanticToolQualityTests.cs",
      "StartLine": 280,
      "EndLine": 280
    }
  ],
  "UsageCount": 0,
  "LastUpdated": "2026-05-17T03:55:00.0000000Z"
}