{
  "Id": "project-wiki-benchmarkdotnet-suite",
  "Content": "MemorySmith.Benchmarks is an active solution project for BenchmarkDotNet coverage of lexical, semantic, hybrid, chat-context hybrid, and context-pack workloads. The chat-context workload queries terms such as stop generating, model used, GitHub, Haiku, history, context usage, Ctrl+V paste, and intercepted MCP/wiki tool calls so benchmark smoke catches whether the live project wiki stays useful for chat/search dogfooding. Use dotnet run -c Release --project MemorySmith.Benchmarks -- --smoke for fast construction/runtime validation and dotnet run -c Release --project MemorySmith.Benchmarks -- --filter *SearchBenchmarks* for the benchmark suite.",
  "Title": "BenchmarkDotNet search benchmark suite",
  "Status": 2,
  "Confidence": 0.93,
  "Tags": [
    "benchmarks",
    "project-wiki",
    "search",
    "tests"
  ],
  "References": [
    "project-wiki-test-architecture",
    "project-wiki-validation-command",
    "project-wiki-semantic-tool-quality-suite"
  ],
  "Conflicts": [],
  "SourceLinks": [
    {
      "Label": "Benchmark project package",
      "Uri": "%MemorySmithRepo%MemorySmith.Benchmarks/MemorySmith.Benchmarks.csproj",
      "StartLine": 1,
      "EndLine": 13
    },
    {
      "Label": "Benchmark workloads and smoke path",
      "Uri": "%MemorySmithRepo%MemorySmith.Benchmarks/SearchBenchmarks.cs",
      "StartLine": 1,
      "EndLine": 70
    },
    {
      "Label": "Benchmark entry point",
      "Uri": "%MemorySmithRepo%MemorySmith.Benchmarks/Program.cs",
      "StartLine": 1,
      "EndLine": 10
    },
    {
      "Label": "README benchmark commands",
      "Uri": "%MemorySmithRepo%README.md",
      "StartLine": 187,
      "EndLine": 188
    }
  ],
  "UsageCount": 0,
  "LastUpdated": "2026-05-23T00:00:00Z"
}