{
  "Id": "ai-memory-suite-implementation-plan-20260520",
  "Title": "AI Memory Suite Implementation Plan",
  "Content": "A full six-seat, ten-round council review produced a phased implementation plan for turning MemorySmith into a governed AI memory suite. The plan recommends a custom per-wiki tag policy with allowlists, blocklists, aliases, lexical-analysis suggestions, and UI tag management; warning-first staleness and supersession diagnostics; a Phase 0 audit of automatic maintenance deprecation behavior; structured JSON tool envelopes; source-backed Agent write proposals; and evidence-gated schema/page retrieval upgrades. The plan is documentation only and does not implement code. It makes current maintenance status mutation a first gate because triage and consolidation can move records to Deprecated by score before the warning-first model exists.",
  "Status": 1,
  "Confidence": 0.86,
  "Tags": [
    "project-wiki",
    "memory-system",
    "implementation-plan",
    "council-review",
    "agent-memory",
    "tag-governance",
    "staleness",
    "search",
    "chat",
    "pages",
    "working"
  ],
  "References": [
    "memory-system-rfc-council-review-20260520",
    "project-wiki-search-roadmap",
    "project-wiki-chat-agent-provider",
    "project-wiki-markdown-pages",
    "project-wiki-mcp-context-pack",
    "project-wiki-source-links-feature",
    "project-wiki-semantic-ui-current",
    "project-wiki-current-validation-146-tests"
  ],
  "Conflicts": [],
  "SourceLinks": [
    {
      "Label": "AI Memory Suite Implementation Plan",
      "Uri": "%MemorySmithRepo%Data/Pages/ai-memory-suite-implementation-plan.md"
    },
    {
      "Label": "Core Memory System Improvements RFC",
      "Uri": "%MemorySmithRepo%Data/Pages/temp-plan.md"
    },
    {
      "Label": "Memory maintenance tasks",
      "Uri": "%MemorySmithRepo%MemorySmith.App/Services/MemoryMaintenanceTasks.cs"
    },
    {
      "Label": "Memory state machine",
      "Uri": "%MemorySmithRepo%MemorySmith.Core/StateMachine/MemoryStateMachine.cs"
    }
  ],
  "UsageCount": 0,
  "LastUpdated": "2026-05-20T04:45:00Z"
}