{
  "Id": "project-wiki-mcp-search-tools-current",
  "Title": "MCP Search Tools Current State",
  "Content": "MemorySmith.App now exposes POST /api/memories/search/semantic for local semantic baseline ranking and /mcp for HTTP JSON-RPC tool access. The MCP tools are memorysmith_search, memorysmith_semantic_search, and memorysmith_get. .vscode/mcp.json points directly at http://localhost:5089/mcp. The implementation is covered by McpAndSemanticSearchTests, which use copied Data/Memories fixtures so the source project wiki remains stable.",
  "Status": 2,
  "Confidence": 0.93,
  "Tags": [
    "project-wiki",
    "mcp",
    "search",
    "semantic-search",
    "current-state",
    "tooling"
  ],
  "References": [
    "project-wiki-mcp-integration",
    "project-wiki-search-roadmap",
    "project-wiki-semantic-search-gap",
    "project-wiki-data-folder-policy"
  ],
  "Conflicts": [],
  "UsageCount": 1,
  "LastUpdated": "2026-05-12T00:00:00Z"
}